"No.","Time","Source","Destination","Protocol","Length","Info"
"1","0.000000","192.168.43.3","239.255.255.250","SSDP","215","M-SEARCH * HTTP/1.1 "
"2","1.000506","192.168.43.3","239.255.255.250","SSDP","215","M-SEARCH * HTTP/1.1 "
"3","2.437615","69.171.250.60","192.168.43.3","TLSv1.2","161","Application Data"
"4","2.635170","192.168.43.3","69.171.250.60","TCP","54","49528  >  443 [ACK] Seq=1 Ack=108 Win=16554 Len=0"
"5","6.962979","69.171.250.60","192.168.43.3","TLSv1.2","295","Application Data"
"6","7.170236","192.168.43.3","69.171.250.60","TCP","54","49528  >  443 [ACK] Seq=1 Ack=349 Win=16493 Len=0"
"7","11.895299","HonHaiPr_48:58:9d","1a:02:ae:9a:0d:ef","ARP","42","Who has 192.168.43.92? Tell 192.168.43.3"
"8","11.898376","1a:02:ae:9a:0d:ef","HonHaiPr_48:58:9d","ARP","42","192.168.43.92 is at 1a:02:ae:9a:0d:ef"
"9","12.189396","1a:02:ae:9a:0d:ef","HonHaiPr_48:58:9d","ARP","42","Who has 192.168.43.3? Tell 192.168.43.92"
"10","12.189444","HonHaiPr_48:58:9d","1a:02:ae:9a:0d:ef","ARP","42","192.168.43.3 is at c4:8e:8f:48:58:9d"
"11","22.149284","192.168.43.3","192.168.43.92","DNS","71","Standard query 0xc312 A i.ytimg.com"
"12","22.400872","192.168.43.92","192.168.43.3","DNS","87","Standard query response 0xc312 A i.ytimg.com A 172.217.26.86"
"13","22.420936","192.168.43.3","172.217.26.86","UDP","1392","60011  >  443 Len=1350"
"14","22.756807","172.217.26.86","192.168.43.3","UDP","1392","443  >  60011 Len=1350"
"15","22.758721","192.168.43.3","172.217.26.86","UDP","75","60011  >  443 Len=33"
"16","24.408968","192.168.43.3","192.168.43.92","DNS","76","Standard query 0x044b A web.whatsapp.com"
"17","24.495632","192.168.43.3","69.171.250.60","TLSv1.2","812","Application Data"
"18","24.616202","192.168.43.92","192.168.43.3","DNS","129","Standard query response 0x044b A web.whatsapp.com CNAME mmx-ds.cdn.whatsapp.net A 69.171.250.60"
"19","24.617839","192.168.43.3","69.171.250.60","TCP","66","49541  >  443 [SYN] Seq=0 Win=8192 Len=0 MSS=1460 WS=4 SACK_PERM=1"
"20","24.658486","192.168.43.3","69.171.250.60","TCP","66","49542  >  443 [SYN] Seq=0 Win=8192 Len=0 MSS=1460 WS=4 SACK_PERM=1"
"21","24.686456","69.171.250.60","192.168.43.3","TCP","54","443  >  49528 [ACK] Seq=349 Ack=759 Win=425 Len=0"
"22","24.727364","69.171.250.60","192.168.43.3","TCP","66","443  >  49541 [SYN, ACK] Seq=0 Ack=1 Win=27840 Len=0 MSS=1392 SACK_PERM=1 WS=256"
"23","24.727450","192.168.43.3","69.171.250.60","TCP","54","49541  >  443 [ACK] Seq=1 Ack=1 Win=66816 Len=0"
"24","24.748482","192.168.43.3","69.171.250.60","TLSv1.3","571","Client Hello"
"25","24.785717","69.171.250.60","192.168.43.3","TCP","66","443  >  49542 [SYN, ACK] Seq=0 Ack=1 Win=65535 Len=0 MSS=1392 SACK_PERM=1 WS=256"
"26","24.785805","192.168.43.3","69.171.250.60","TCP","54","49542  >  443 [ACK] Seq=1 Ack=1 Win=66816 Len=0"
"27","24.786858","192.168.43.3","69.171.250.60","TLSv1.3","571","Client Hello"
"28","24.962806","69.171.250.60","192.168.43.3","TLSv1.2","87","Application Data"
"29","25.008584","69.171.250.60","192.168.43.3","TLSv1.3","266","Server Hello, Change Cipher Spec, Application Data"
"30","25.014363","69.171.250.60","192.168.43.3","TCP","54","443  >  49542 [ACK] Seq=1 Ack=518 Win=66816 Len=0"
"31","25.058924","69.171.250.60","192.168.43.3","TLSv1.3","1446","Server Hello, Change Cipher Spec, Application Data"
"32","25.066075","192.168.43.3","69.171.250.60","TLSv1.3","118","Change Cipher Spec, Application Data"
"33","25.086953","192.168.43.3","69.171.250.60","TLSv1.3","146","Application Data"
"34","25.098268","192.168.43.3","69.171.250.60","TLSv1.3","336","Application Data"
"35","25.168453","192.168.43.3","69.171.250.60","TCP","54","49528  >  443 [ACK] Seq=759 Ack=382 Win=16485 Len=0"
"36","25.258388","192.168.43.3","69.171.250.60","TCP","54","49542  >  443 [ACK] Seq=518 Ack=1393 Win=66816 Len=0"
"37","25.283163","69.171.250.60","192.168.43.3","TLSv1.3","266","[TCP Spurious Retransmission] , Server Hello, Change Cipher Spec, Application Data"
"38","25.283213","192.168.43.3","69.171.250.60","TCP","66","[TCP Dup ACK 32#1] 49541  >  443 [ACK] Seq=956 Ack=213 Win=66604 Len=0 SLE=1 SRE=213"
"39","25.299474","69.171.250.60","192.168.43.3","TLSv1.3","211","Application Data"
"40","25.305215","69.171.250.60","192.168.43.3","TLSv1.3","128","Application Data"
"41","25.305266","192.168.43.3","69.171.250.60","TCP","54","49541  >  443 [ACK] Seq=956 Ack=444 Win=66372 Len=0"
"42","25.306180","192.168.43.3","69.171.250.60","TLSv1.3","85","Application Data"
"43","25.353569","69.171.250.60","192.168.43.3","TLSv1.3","923","Application Data"
"44","25.354284","69.171.250.60","192.168.43.3","TLSv1.3","85","Application Data"
"45","25.354390","69.171.250.60","192.168.43.3","TLSv1.3","89","Application Data"
"46","25.354439","192.168.43.3","69.171.250.60","TCP","54","49541  >  443 [ACK] Seq=987 Ack=510 Win=66304 Len=0"
"47","25.358825","192.168.43.3","69.171.250.60","TLSv1.3","118","Change Cipher Spec, Application Data"
"48","25.496719","192.168.43.3","69.171.250.60","TLSv1.2","140","Application Data"
"49","25.592345","69.171.250.60","192.168.43.3","TCP","54","443  >  49542 [ACK] Seq=2262 Ack=582 Win=66816 Len=0"
"50","25.592446","69.171.250.60","192.168.43.3","TLSv1.3","128","[TCP Previous segment not captured] , Application Data"
"51","25.592487","192.168.43.3","69.171.250.60","TCP","66","[TCP Dup ACK 47#1] 49542  >  443 [ACK] Seq=582 Ack=2262 Win=65944 Len=0 SLE=2433 SRE=2507"
"52","25.607589","69.171.250.60","192.168.43.3","TCP","225","[TCP Out-Of-Order] 443  >  49542 [PSH, ACK] Seq=2262 Ack=582 Win=66816 Len=171"
"53","25.607662","192.168.43.3","69.171.250.60","TCP","54","49542  >  443 [ACK] Seq=582 Ack=2507 Win=65700 Len=0"
"54","25.726223","69.171.250.60","192.168.43.3","TCP","54","[TCP Previous segment not captured] 443  >  49528 [ACK] Seq=417 Ack=845 Win=425 Len=0"
"55","25.848300","192.168.43.3","69.171.250.60","TCP","85","[TCP Retransmission] 49541  >  443 [PSH, ACK] Seq=956 Ack=510 Win=66304 Len=31"
"56","25.877456","69.171.250.60","192.168.43.3","TLSv1.2","87","Application Data"
"57","25.877514","192.168.43.3","69.171.250.60","TCP","66","[TCP Dup ACK 35#1] 49528  >  443 [ACK] Seq=845 Ack=382 Win=16485 Len=0 SLE=417 SRE=450"
"58","26.078131","69.171.250.60","192.168.43.3","TCP","54","[TCP Previous segment not captured] 443  >  49541 [ACK] Seq=1819 Ack=987 Win=30208 Len=0"
"59","26.081990","69.171.250.60","192.168.43.3","TCP","89","[TCP Retransmission] 443  >  49528 [PSH, ACK] Seq=382 Ack=845 Win=425 Len=35"
"60","26.082057","192.168.43.3","69.171.250.60","TCP","54","49528  >  443 [ACK] Seq=845 Ack=450 Win=16468 Len=0"
"61","26.300726","192.168.43.3","69.171.250.60","TLSv1.2","173","Application Data"
"62","26.320233","69.171.250.60","192.168.43.3","TLSv1.2","258","Application Data"
"63","26.474488","69.171.250.60","192.168.43.3","TCP","54","443  >  49528 [ACK] Seq=654 Ack=964 Win=425 Len=0"
"64","26.518028","192.168.43.3","69.171.250.60","TCP","54","49528  >  443 [ACK] Seq=964 Ack=654 Win=16417 Len=0"
"65","26.741755","69.171.250.60","192.168.43.3","TLSv1.2","87","Application Data"
"66","26.793570","69.171.250.60","192.168.43.3","TCP","1363","[TCP Retransmission] 443  >  49541 [PSH, ACK] Seq=510 Ack=987 Win=30208 Len=1309"
"67","26.947980","192.168.43.3","69.171.250.60","TCP","54","49528  >  443 [ACK] Seq=964 Ack=687 Win=16409 Len=0"
"68","26.998248","192.168.43.3","69.171.250.60","TCP","54","49541  >  443 [ACK] Seq=987 Ack=1819 Win=66816 Len=0"
"69","27.961090","69.171.250.60","192.168.43.3","TLSv1.2","220","[TCP Previous segment not captured] , Application Data, Application Data"
"70","27.961158","192.168.43.3","69.171.250.60","TCP","66","[TCP Dup ACK 67#1] 49528  >  443 [ACK] Seq=964 Ack=687 Win=16409 Len=0 SLE=893 SRE=1059"
"71","28.063110","69.171.250.60","192.168.43.3","TCP","260","[TCP Retransmission] 443  >  49528 [PSH, ACK] Seq=687 Ack=964 Win=425 Len=206"
"72","28.063224","192.168.43.3","69.171.250.60","TCP","54","49528  >  443 [ACK] Seq=964 Ack=1059 Win=16704 Len=0"
"73","29.850033","1a:02:ae:9a:0d:ef","HonHaiPr_48:58:9d","ARP","42","Who has 192.168.43.3? Tell 192.168.43.92"
"74","29.850096","HonHaiPr_48:58:9d","1a:02:ae:9a:0d:ef","ARP","42","192.168.43.3 is at c4:8e:8f:48:58:9d"
"75","30.395802","HonHaiPr_48:58:9d","1a:02:ae:9a:0d:ef","ARP","42","Who has 192.168.43.92? Tell 192.168.43.3"
"76","30.398153","1a:02:ae:9a:0d:ef","HonHaiPr_48:58:9d","ARP","42","192.168.43.92 is at 1a:02:ae:9a:0d:ef"
"77","30.661836","192.168.43.3","69.171.250.60","TCP","54","49542  >  443 [FIN, ACK] Seq=582 Ack=2507 Win=65700 Len=0"
"78","30.662110","192.168.43.3","69.171.250.60","TCP","54","49541  >  443 [FIN, ACK] Seq=987 Ack=1819 Win=66816 Len=0"
"79","31.141110","192.168.43.3","69.171.250.60","TCP","54","[TCP Retransmission] 49542  >  443 [FIN, ACK] Seq=582 Ack=2507 Win=65700 Len=0"
"80","31.250829","69.171.250.60","192.168.43.3","TCP","54","[TCP Previous segment not captured] 443  >  49542 [ACK] Seq=2508 Ack=583 Win=66816 Len=0"
"81","31.370090","69.171.250.60","192.168.43.3","TCP","54","[TCP Out-Of-Order] 443  >  49542 [FIN, ACK] Seq=2507 Ack=583 Win=66816 Len=0"
"82","31.370176","192.168.43.3","69.171.250.60","TCP","54","49542  >  443 [ACK] Seq=583 Ack=2508 Win=65700 Len=0"
"83","32.130681","192.168.43.3","69.171.250.60","TCP","54","[TCP Retransmission] 49541  >  443 [FIN, ACK] Seq=987 Ack=1819 Win=66816 Len=0"
"84","32.238430","69.171.250.60","192.168.43.3","TCP","54","[TCP Previous segment not captured] 443  >  49541 [ACK] Seq=1820 Ack=988 Win=30208 Len=0"
"85","32.925054","69.171.250.60","192.168.43.3","TCP","54","[TCP Retransmission] 443  >  49541 [FIN, ACK] Seq=1819 Ack=988 Win=30208 Len=0"
"86","32.925122","192.168.43.3","69.171.250.60","TCP","54","49541  >  443 [ACK] Seq=988 Ack=1820 Win=66816 Len=0"
"87","34.918126","192.168.43.3","69.171.250.60","TCP","66","49543  >  443 [SYN] Seq=0 Win=8192 Len=0 MSS=1460 WS=4 SACK_PERM=1"
"88","35.017973","192.168.43.3","192.168.43.92","DNS","75","Standard query 0xd90c A www.youtube.com"
"89","35.074847","69.171.250.60","192.168.43.3","TCP","66","443  >  49543 [SYN, ACK] Seq=0 Ack=1 Win=27840 Len=0 MSS=1392 SACK_PERM=1 WS=256"
"90","35.074941","192.168.43.3","69.171.250.60","TCP","54","49543  >  443 [ACK] Seq=1 Ack=1 Win=66816 Len=0"
"91","35.076421","192.168.43.3","69.171.250.60","TLSv1.3","571","Client Hello"
"92","35.114819","192.168.43.92","192.168.43.3","DNS","237","Standard query response 0xd90c A www.youtube.com CNAME youtube-ui.l.google.com A 172.217.194.190 A 172.217.194.91 A 172.217.194.136 A 172.217.194.93 A 172.217.160.46 A 74.125.24.190 A 74.125.24.93 A 74.125.68.91"
"93","35.121103","192.168.43.3","172.217.194.190","UDP","1392","57120  >  443 Len=1350"
"94","35.205083","69.171.250.60","192.168.43.3","TLSv1.3","266","Server Hello, Change Cipher Spec, Application Data"
"95","35.208752","192.168.43.3","69.171.250.60","TLSv1.3","118","Change Cipher Spec, Application Data"
"96","35.209536","192.168.43.3","69.171.250.60","TLSv1.3","146","Application Data"
"97","35.209969","192.168.43.3","69.171.250.60","TLSv1.3","392","Application Data"
"98","35.210128","192.168.43.3","69.171.250.60","TCP","1446","49543  >  443 [ACK] Seq=1012 Ack=213 Win=66604 Len=1392 [TCP segment of a reassembled PDU]"
"99","35.210141","192.168.43.3","69.171.250.60","TCP","1446","49543  >  443 [ACK] Seq=2404 Ack=213 Win=66604 Len=1392 [TCP segment of a reassembled PDU]"
"100","35.239738","172.217.194.190","192.168.43.3","UDP","1392","443  >  57120 Len=1350"
"101","35.241502","192.168.43.3","172.217.194.190","UDP","75","57120  >  443 Len=33"
"102","35.242880","192.168.43.3","172.217.194.190","UDP","1392","57120  >  443 Len=1350"
"103","35.243037","192.168.43.3","172.217.194.190","UDP","700","57120  >  443 Len=658"
"104","35.243176","192.168.43.3","172.217.194.190","UDP","1392","57120  >  443 Len=1350"
"105","35.243268","192.168.43.3","172.217.194.190","UDP","120","57120  >  443 Len=78"
"106","35.309881","69.171.250.60","192.168.43.3","TLSv1.3","128","[TCP Previous segment not captured] , Application Data"
"107","35.309950","192.168.43.3","69.171.250.60","TCP","66","[TCP Dup ACK 95#1] 49543  >  443 [ACK] Seq=3796 Ack=213 Win=66604 Len=0 SLE=370 SRE=444"
"108","35.310070","192.168.43.3","69.171.250.60","TLSv1.3","205","Application Data [TCP segment of a reassembled PDU]"
"109","35.310208","69.171.250.60","192.168.43.3","TCP","211","[TCP Out-Of-Order] 443  >  49543 [PSH, ACK] Seq=213 Ack=582 Win=28928 Len=157"
"110","35.310250","192.168.43.3","69.171.250.60","TCP","54","49543  >  443 [ACK] Seq=3947 Ack=444 Win=66372 Len=0"
"111","35.316790","69.171.250.60","192.168.43.3","TCP","54","443  >  49543 [ACK] Seq=444 Ack=1012 Win=30208 Len=0"
"112","35.316792","69.171.250.60","192.168.43.3","TLSv1.3","98","Application Data"
"113","35.333608","69.171.250.60","192.168.43.3","TCP","54","443  >  49543 [ACK] Seq=488 Ack=3796 Win=35584 Len=0"
"114","35.333698","192.168.43.3","69.171.250.60","TCP","1446","49543  >  443 [ACK] Seq=3947 Ack=488 Win=66328 Len=1392 [TCP segment of a reassembled PDU]"
"115","35.333718","192.168.43.3","69.171.250.60","TCP","1446","49543  >  443 [ACK] Seq=5339 Ack=488 Win=66328 Len=1392 [TCP segment of a reassembled PDU]"
"116","35.333734","192.168.43.3","69.171.250.60","TLSv1.3","1446","Application Data [TCP segment of a reassembled PDU]"
"117","35.333745","192.168.43.3","69.171.250.60","TCP","1446","49543  >  443 [ACK] Seq=8123 Ack=488 Win=66328 Len=1392 [TCP segment of a reassembled PDU]"
"118","35.333756","192.168.43.3","69.171.250.60","TLSv1.3","914","Application Data [TCP segment of a reassembled PDU]"
"119","35.364569","172.217.194.190","192.168.43.3","UDP","67","443  >  57120 Len=25"
"120","35.378754","172.217.194.190","192.168.43.3","UDP","756","443  >  57120 Len=714"
"121","35.378757","172.217.194.190","192.168.43.3","UDP","77","443  >  57120 Len=35"
"122","35.379878","192.168.43.3","172.217.194.190","UDP","77","57120  >  443 Len=35"
"123","35.380151","192.168.43.3","172.217.194.190","UDP","77","57120  >  443 Len=35"
"124","35.466700","69.171.250.60","192.168.43.3","TCP","54","443  >  49543 [ACK] Seq=488 Ack=5339 Win=41216 Len=0"
"125","35.466765","192.168.43.3","69.171.250.60","TCP","1446","49543  >  443 [ACK] Seq=10375 Ack=488 Win=66328 Len=1392 [TCP segment of a reassembled PDU]"
"126","35.466775","192.168.43.3","69.171.250.60","TLSv1.3","1446","Application Data [TCP segment of a reassembled PDU]"
"127","35.466920","69.171.250.60","192.168.43.3","TCP","54","443  >  49543 [ACK] Seq=488 Ack=8123 Win=46848 Len=0"
"128","35.466948","192.168.43.3","69.171.250.60","TCP","1446","49543  >  443 [ACK] Seq=13159 Ack=488 Win=66328 Len=1392 [TCP segment of a reassembled PDU]"
"129","35.466954","192.168.43.3","69.171.250.60","TLSv1.3","1446","Application Data [TCP segment of a reassembled PDU]"
"130","35.466959","192.168.43.3","69.171.250.60","TCP","1446","49543  >  443 [ACK] Seq=15943 Ack=488 Win=66328 Len=1392 [TCP segment of a reassembled PDU]"
"131","35.466965","192.168.43.3","69.171.250.60","TLSv1.3","1446","Application Data [TCP segment of a reassembled PDU]"
"132","35.473448","69.171.250.60","192.168.43.3","TCP","54","443  >  49543 [ACK] Seq=488 Ack=10375 Win=52480 Len=0"
"133","35.473485","192.168.43.3","69.171.250.60","TCP","1446","49543  >  443 [ACK] Seq=18727 Ack=488 Win=66328 Len=1392 [TCP segment of a reassembled PDU]"
"134","35.473492","192.168.43.3","69.171.250.60","TLSv1.3","1446","Application Data [TCP segment of a reassembled PDU]"
"135","35.473498","192.168.43.3","69.171.250.60","TCP","1446","49543  >  443 [ACK] Seq=21511 Ack=488 Win=66328 Len=1392 [TCP segment of a reassembled PDU]"
"136","35.485797","192.168.43.3","172.217.194.190","UDP","1392","57120  >  443 Len=1350"
"137","35.585908","69.171.250.60","192.168.43.3","TCP","54","443  >  49543 [ACK] Seq=488 Ack=13159 Win=57856 Len=0"
"138","35.585976","192.168.43.3","69.171.250.60","TLSv1.3","1446","Application Data [TCP segment of a reassembled PDU]"
"139","35.585988","192.168.43.3","69.171.250.60","TLSv1.3","1408","Application Data, Application Data"
"140","35.594556","69.171.250.60","192.168.43.3","TCP","54","443  >  49543 [ACK] Seq=488 Ack=18727 Win=69120 Len=0"
"141","35.623833","172.217.194.190","192.168.43.3","UDP","67","443  >  57120 Len=25"
"142","35.690939","69.171.250.60","192.168.43.3","TCP","54","443  >  49543 [ACK] Seq=488 Ack=24295 Win=80128 Len=0"
"143","35.981806","69.171.250.60","192.168.43.3","TLSv1.3","236","Application Data"
"144","36.181036","192.168.43.3","69.171.250.60","TCP","54","49543  >  443 [ACK] Seq=25649 Ack=670 Win=66144 Len=0"
"145","36.295055","69.171.250.60","192.168.43.3","TLSv1.3","236","[TCP Spurious Retransmission] , Application Data"
"146","36.295113","192.168.43.3","69.171.250.60","TCP","66","[TCP Dup ACK 144#1] 49543  >  443 [ACK] Seq=25649 Ack=670 Win=66144 Len=0 SLE=488 SRE=670"
"147","37.503998","69.171.250.60","192.168.43.3","TLSv1.2","143","Application Data"
"148","37.700736","192.168.43.3","69.171.250.60","TCP","54","49528  >  443 [ACK] Seq=964 Ack=1148 Win=16681 Len=0"
"149","38.090643","192.168.43.3","74.125.68.188","TCP","55","49534  >  5228 [ACK] Seq=1 Ack=1 Win=16274 Len=1"
"150","38.185462","74.125.68.188","192.168.43.3","TCP","66","5228  >  49534 [ACK] Seq=1 Ack=2 Win=265 Len=0 SLE=1 SRE=2"
"151","40.671146","192.168.43.3","69.171.250.60","TCP","54","49543  >  443 [FIN, ACK] Seq=25649 Ack=670 Win=66144 Len=0"
"152","41.150911","69.171.250.60","192.168.43.3","TCP","54","443  >  49543 [FIN, ACK] Seq=670 Ack=25650 Win=82944 Len=0"
"153","41.151014","192.168.43.3","69.171.250.60","TCP","54","49543  >  443 [ACK] Seq=25650 Ack=671 Win=66144 Len=0"
"154","46.232944","1a:02:ae:9a:0d:ef","HonHaiPr_48:58:9d","ARP","42","Who has 192.168.43.3? Tell 192.168.43.92"
"155","46.232993","HonHaiPr_48:58:9d","1a:02:ae:9a:0d:ef","ARP","42","192.168.43.3 is at c4:8e:8f:48:58:9d"
"156","54.045298","192.168.43.3","69.171.250.60","TLSv1.2","85","Application Data"
"157","54.145501","69.171.250.60","192.168.43.3","TCP","54","443  >  49528 [ACK] Seq=1148 Ack=995 Win=425 Len=0"
"158","54.367400","69.171.250.60","192.168.43.3","TLSv1.2","92","Application Data"
"159","54.564815","192.168.43.3","69.171.250.60","TCP","54","49528  >  443 [ACK] Seq=995 Ack=1186 Win=16672 Len=0"
"160","65.126236","192.168.43.3","69.171.250.60","TLSv1.2","85","Application Data"
"161","65.223004","69.171.250.60","192.168.43.3","TCP","54","443  >  49528 [ACK] Seq=1186 Ack=1026 Win=425 Len=0"
"162","65.438968","69.171.250.60","192.168.43.3","TLSv1.2","92","Application Data"
"163","65.634243","192.168.43.3","69.171.250.60","TCP","54","49528  >  443 [ACK] Seq=1026 Ack=1224 Win=16662 Len=0"
"164","69.893472","HonHaiPr_48:58:9d","1a:02:ae:9a:0d:ef","ARP","42","Who has 192.168.43.92? Tell 192.168.43.3"
"165","69.896093","1a:02:ae:9a:0d:ef","HonHaiPr_48:58:9d","ARP","42","192.168.43.92 is at 1a:02:ae:9a:0d:ef"
"166","70.295630","1a:02:ae:9a:0d:ef","HonHaiPr_48:58:9d","ARP","42","Who has 192.168.43.3? Tell 192.168.43.92"
"167","70.295665","HonHaiPr_48:58:9d","1a:02:ae:9a:0d:ef","ARP","42","192.168.43.3 is at c4:8e:8f:48:58:9d"
"168","79.122440","69.171.250.60","192.168.43.3","TLSv1.2","173","Application Data"
"169","79.328246","192.168.43.3","69.171.250.60","TCP","54","49528  >  443 [ACK] Seq=1026 Ack=1343 Win=16633 Len=0"
"170","83.187887","192.168.43.3","74.125.68.188","TCP","55","[TCP Keep-Alive] 49534  >  5228 [ACK] Seq=1 Ack=1 Win=16274 Len=1"
"171","83.355014","74.125.68.188","192.168.43.3","TCP","66","[TCP Keep-Alive ACK] 5228  >  49534 [ACK] Seq=1 Ack=2 Win=265 Len=0 SLE=1 SRE=2"
"172","86.521879","69.171.250.60","192.168.43.3","TLSv1.2","566","[TCP Previous segment not captured] , Ignored Unknown Record"
"173","86.521943","192.168.43.3","69.171.250.60","TCP","66","[TCP Dup ACK 169#1] 49528  >  443 [ACK] Seq=1026 Ack=1343 Win=16633 Len=0 SLE=2367 SRE=2879"
"174","88.470684","1a:02:ae:9a:0d:ef","HonHaiPr_48:58:9d","ARP","42","Who has 192.168.43.3? Tell 192.168.43.92"
"175","88.470722","HonHaiPr_48:58:9d","1a:02:ae:9a:0d:ef","ARP","42","192.168.43.3 is at c4:8e:8f:48:58:9d"
"176","88.868939","69.171.250.60","192.168.43.3","TCP","566","[TCP Retransmission] 443  >  49528 [ACK] Seq=1343 Ack=1026 Win=425 Len=512"
"177","88.869006","192.168.43.3","69.171.250.60","TCP","66","49528  >  443 [ACK] Seq=1026 Ack=1855 Win=16505 Len=0 SLE=2367 SRE=2879"
"178","91.938309","69.171.250.60","192.168.43.3","TCP","566","[TCP Retransmission] 443  >  49528 [ACK] Seq=1855 Ack=1026 Win=425 Len=512"
"179","91.938389","192.168.43.3","69.171.250.60","TCP","54","49528  >  443 [ACK] Seq=1026 Ack=2879 Win=16704 Len=0"
"180","92.019599","69.171.250.60","192.168.43.3","TLSv1.2","377","Ignored Unknown Record"
"181","92.217732","192.168.43.3","69.171.250.60","TCP","54","49528  >  443 [ACK] Seq=1026 Ack=3202 Win=16623 Len=0"
"182","94.151332","69.171.250.60","192.168.43.3","TLSv1.2","279","[TCP Previous segment not captured] , Application Data"
"183","94.151429","192.168.43.3","69.171.250.60","TCP","66","[TCP Dup ACK 181#1] 49528  >  443 [ACK] Seq=1026 Ack=3202 Win=16623 Len=0 SLE=3336 SRE=3561"
"184","94.240051","69.171.250.60","192.168.43.3","TCP","188","[TCP Retransmission] 443  >  49528 [PSH, ACK] Seq=3202 Ack=1026 Win=425 Len=134"
"185","94.240170","192.168.43.3","69.171.250.60","TCP","54","49528  >  443 [ACK] Seq=1026 Ack=3561 Win=16533 Len=0"
"186","100.291472","192.168.43.3","172.217.194.190","UDP","1392","57122  >  443 Len=1350"
"187","100.434651","172.217.194.190","192.168.43.3","UDP","1392","443  >  57122 Len=1350"
"188","100.436753","192.168.43.3","172.217.194.190","UDP","75","57122  >  443 Len=33"
"189","100.438184","192.168.43.3","172.217.194.190","UDP","1392","57122  >  443 Len=1350"
"190","100.438368","192.168.43.3","172.217.194.190","UDP","699","57122  >  443 Len=657"
"191","100.438535","192.168.43.3","172.217.194.190","UDP","1081","57122  >  443 Len=1039"
"192","100.550440","172.217.194.190","192.168.43.3","UDP","764","443  >  57122 Len=722"
"193","100.551039","172.217.194.190","192.168.43.3","UDP","233","443  >  57122 Len=191"
"194","100.552550","192.168.43.3","172.217.194.190","UDP","77","57122  >  443 Len=35"
"195","100.553082","192.168.43.3","172.217.194.190","UDP","77","57122  >  443 Len=35"
"196","100.561925","192.168.43.3","192.168.43.92","DNS","80","Standard query 0x6a5a A beacons.gcp.gvt2.com"
"197","100.701288","192.168.43.92","192.168.43.3","DNS","126","Standard query response 0x6a5a A beacons.gcp.gvt2.com CNAME beacons-handoff.gcp.gvt2.com A 172.217.194.94"
"198","100.711240","192.168.43.3","172.217.194.94","UDP","1392","58766  >  443 Len=1350"
"199","100.829057","172.217.194.94","192.168.43.3","UDP","1392","443  >  58766 Len=1350"
"200","100.836457","172.217.194.94","192.168.43.3","UDP","1392","443  >  58766 Len=1350"
"201","100.842654","192.168.43.3","172.217.194.94","UDP","1392","58766  >  443 Len=1350"
"202","100.933951","172.217.194.94","192.168.43.3","UDP","1392","443  >  58766 Len=1350"
"203","100.936113","192.168.43.3","172.217.194.94","UDP","75","58766  >  443 Len=33"
"204","100.936714","192.168.43.3","172.217.194.94","UDP","545","58766  >  443 Len=503"
"205","101.212043","192.168.43.3","172.217.194.94","UDP","545","58766  >  443 Len=503"
"206","101.252319","172.217.194.94","192.168.43.3","UDP","1075","443  >  58766 Len=1033"
"207","101.253311","192.168.43.3","172.217.194.94","UDP","77","58766  >  443 Len=35"
"208","101.254566","192.168.43.3","172.217.194.94","UDP","85","58766  >  443 Len=43"
"209","101.339538","172.217.194.94","192.168.43.3","UDP","67","443  >  58766 Len=25"
"210","101.352860","172.217.194.94","192.168.43.3","UDP","68","443  >  58766 Len=26"
"211","101.381827","192.168.43.3","172.217.194.94","UDP","75","58766  >  443 Len=33"
"212","104.891979","HonHaiPr_48:58:9d","1a:02:ae:9a:0d:ef","ARP","42","Who has 192.168.43.92? Tell 192.168.43.3"
"213","104.897071","1a:02:ae:9a:0d:ef","HonHaiPr_48:58:9d","ARP","42","192.168.43.92 is at 1a:02:ae:9a:0d:ef"
"214","106.024886","192.168.43.3","69.171.250.60","TLSv1.2","180","Application Data"
"215","106.115722","69.171.250.60","192.168.43.3","TCP","54","443  >  49528 [ACK] Seq=3561 Ack=1152 Win=425 Len=0"
"216","111.253501","1a:02:ae:9a:0d:ef","HonHaiPr_48:58:9d","ARP","42","Who has 192.168.43.3? Tell 192.168.43.92"
"217","111.253550","HonHaiPr_48:58:9d","1a:02:ae:9a:0d:ef","ARP","42","192.168.43.3 is at c4:8e:8f:48:58:9d"
"218","117.995190","192.168.43.3","239.255.255.250","SSDP","215","M-SEARCH * HTTP/1.1 "
"219","118.996478","192.168.43.3","239.255.255.250","SSDP","215","M-SEARCH * HTTP/1.1 "
"220","120.000916","192.168.43.3","239.255.255.250","SSDP","215","M-SEARCH * HTTP/1.1 "
"221","121.001374","192.168.43.3","239.255.255.250","SSDP","215","M-SEARCH * HTTP/1.1 "
"222","128.360375","192.168.43.3","74.125.68.188","TCP","55","[TCP Keep-Alive] 49534  >  5228 [ACK] Seq=1 Ack=1 Win=16274 Len=1"
"223","128.451625","74.125.68.188","192.168.43.3","TCP","66","[TCP Keep-Alive ACK] 5228  >  49534 [ACK] Seq=1 Ack=2 Win=265 Len=0 SLE=1 SRE=2"
"224","133.524388","1a:02:ae:9a:0d:ef","HonHaiPr_48:58:9d","ARP","42","Who has 192.168.43.3? Tell 192.168.43.92"
"225","133.524447","HonHaiPr_48:58:9d","1a:02:ae:9a:0d:ef","ARP","42","192.168.43.3 is at c4:8e:8f:48:58:9d"
"226","151.119117","192.168.43.3","69.171.250.60","TCP","55","[TCP Keep-Alive] 49528  >  443 [ACK] Seq=1151 Ack=3561 Win=16533 Len=1"
"227","151.310789","69.171.250.60","192.168.43.3","TCP","54","[TCP Keep-Alive ACK] 443  >  49528 [ACK] Seq=3561 Ack=1152 Win=425 Len=0"
"228","155.888611","HonHaiPr_48:58:9d","1a:02:ae:9a:0d:ef","ARP","42","Who has 192.168.43.92? Tell 192.168.43.3"
"229","155.891463","1a:02:ae:9a:0d:ef","HonHaiPr_48:58:9d","ARP","42","192.168.43.92 is at 1a:02:ae:9a:0d:ef"
"230","156.563672","1a:02:ae:9a:0d:ef","HonHaiPr_48:58:9d","ARP","42","Who has 192.168.43.3? Tell 192.168.43.92"
"231","156.563706","HonHaiPr_48:58:9d","1a:02:ae:9a:0d:ef","ARP","42","192.168.43.3 is at c4:8e:8f:48:58:9d"
"232","170.108126","192.168.43.3","69.171.250.60","TLSv1.2","82","Application Data"
"233","170.193405","69.171.250.60","192.168.43.3","TCP","54","443  >  49528 [ACK] Seq=3561 Ack=1180 Win=425 Len=0"
"234","170.228984","192.168.43.3","192.168.43.92","DNS","76","Standard query 0xda0f A web.whatsapp.com"
"235","170.337876","192.168.43.92","192.168.43.3","DNS","129","Standard query response 0xda0f A web.whatsapp.com CNAME mmx-ds.cdn.whatsapp.net A 69.171.250.60"
"236","170.346796","192.168.43.3","69.171.250.60","TCP","66","49544  >  443 [SYN] Seq=0 Win=8192 Len=0 MSS=1460 WS=4 SACK_PERM=1"
"237","170.443446","69.171.250.60","192.168.43.3","TCP","54","443  >  49528 [FIN, ACK] Seq=3561 Ack=1180 Win=425 Len=0"
"238","170.443516","192.168.43.3","69.171.250.60","TCP","54","49528  >  443 [ACK] Seq=1180 Ack=3562 Win=16533 Len=0"
"239","170.445058","69.171.250.60","192.168.43.3","TCP","66","443  >  49544 [SYN, ACK] Seq=0 Ack=1 Win=27840 Len=0 MSS=1392 SACK_PERM=1 WS=256"
"240","170.445147","192.168.43.3","69.171.250.60","TCP","54","49544  >  443 [ACK] Seq=1 Ack=1 Win=66816 Len=0"
"241","170.450889","192.168.43.3","69.171.250.60","TCP","54","49528  >  443 [FIN, ACK] Seq=1180 Ack=3562 Win=16533 Len=0"
"242","170.452435","192.168.43.3","69.171.250.60","TLSv1.3","571","Client Hello"
"243","170.536732","69.171.250.60","192.168.43.3","TCP","54","443  >  49544 [ACK] Seq=1 Ack=518 Win=28928 Len=0"
"244","170.813865","69.171.250.60","192.168.43.3","TLSv1.3","257","Server Hello, Change Cipher Spec, Application Data"
"245","170.817850","192.168.43.3","69.171.250.60","TCP","54","[TCP Retransmission] 49528  >  443 [FIN, ACK] Seq=1180 Ack=3562 Win=16533 Len=0"
"246","170.822717","192.168.43.3","69.171.250.60","TLSv1.3","118","Change Cipher Spec, Application Data"
"247","170.904485","69.171.250.60","192.168.43.3","TCP","54","443  >  49528 [ACK] Seq=3562 Ack=1181 Win=425 Len=0"
"248","170.913494","69.171.250.60","192.168.43.3","TLSv1.3","209","Application Data"
"249","170.915364","192.168.43.3","69.171.250.60","TLSv1.3","576","Application Data"
"250","171.055152","69.171.250.60","192.168.43.3","TCP","54","443  >  49544 [ACK] Seq=359 Ack=1104 Win=30208 Len=0"
"251","171.533021","69.171.250.60","192.168.43.3","TLSv1.3","242","Application Data"
"252","171.553238","192.168.43.3","192.168.43.92","DNS","80","Standard query 0xec69 A beacons.gcp.gvt2.com"
"253","171.567522","192.168.43.3","192.168.43.92","DNS","75","Standard query 0x88c5 A play.google.com"
"254","171.587933","192.168.43.3","69.171.250.60","TLSv1.3","182","Application Data"
"255","171.591091","192.168.43.3","69.171.250.60","TLSv1.3","310","Application Data"
"256","171.632567","192.168.43.3","69.171.250.60","TCP","1446","49544  >  443 [ACK] Seq=1488 Ack=547 Win=66268 Len=1392 [TCP segment of a reassembled PDU]"
"257","171.632581","192.168.43.3","69.171.250.60","TCP","1446","49544  >  443 [ACK] Seq=2880 Ack=547 Win=66268 Len=1392 [TCP segment of a reassembled PDU]"
"258","171.633545","192.168.43.92","192.168.43.3","DNS","126","Standard query response 0xec69 A beacons.gcp.gvt2.com CNAME beacons-handoff.gcp.gvt2.com A 172.217.194.94"
"259","171.633546","192.168.43.92","192.168.43.3","DNS","171","Standard query response 0x88c5 A play.google.com A 172.217.194.101 A 172.217.194.102 A 172.217.194.138 A 172.217.194.100 A 172.217.194.113 A 172.217.194.139"
"260","171.637740","192.168.43.3","172.217.194.94","UDP","1392","53942  >  443 Len=1350"
"261","171.649362","192.168.43.3","172.217.194.101","UDP","1392","53943  >  443 Len=1350"
"262","171.737148","69.171.250.60","192.168.43.3","TCP","54","443  >  49544 [ACK] Seq=547 Ack=4272 Win=37888 Len=0"
"263","171.737213","192.168.43.3","69.171.250.60","TCP","1446","49544  >  443 [ACK] Seq=4272 Ack=547 Win=66268 Len=1392 [TCP segment of a reassembled PDU]"
"264","171.737223","192.168.43.3","69.171.250.60","TCP","1446","49544  >  443 [ACK] Seq=5664 Ack=547 Win=66268 Len=1392 [TCP segment of a reassembled PDU]"
"265","171.737228","192.168.43.3","69.171.250.60","TCP","1446","49544  >  443 [ACK] Seq=7056 Ack=547 Win=66268 Len=1392 [TCP segment of a reassembled PDU]"
"266","171.737237","192.168.43.3","69.171.250.60","TCP","1446","49544  >  443 [ACK] Seq=8448 Ack=547 Win=66268 Len=1392 [TCP segment of a reassembled PDU]"
"267","171.737243","192.168.43.3","69.171.250.60","TCP","1446","49544  >  443 [ACK] Seq=9840 Ack=547 Win=66268 Len=1392 [TCP segment of a reassembled PDU]"
"268","171.754186","172.217.194.94","192.168.43.3","UDP","1392","443  >  53942 Len=1350"
"269","171.755632","192.168.43.3","172.217.194.94","UDP","75","53942  >  443 Len=33"
"270","171.756480","192.168.43.3","172.217.194.94","UDP","910","53942  >  443 Len=868"
"271","171.782119","172.217.194.101","192.168.43.3","UDP","1392","443  >  53943 Len=1350"
"272","171.784046","192.168.43.3","172.217.194.101","UDP","75","53943  >  443 Len=33"
"273","171.784648","192.168.43.3","172.217.194.101","UDP","1043","53943  >  443 Len=1001"
"274","171.849832","69.171.250.60","192.168.43.3","TCP","54","443  >  49544 [ACK] Seq=547 Ack=7056 Win=43264 Len=0"
"275","171.849905","192.168.43.3","69.171.250.60","TLSv1.3","1446","Application Data [TCP segment of a reassembled PDU]"
"276","171.849920","192.168.43.3","69.171.250.60","TCP","1446","49544  >  443 [ACK] Seq=12624 Ack=547 Win=66268 Len=1392 [TCP segment of a reassembled PDU]"
"277","171.849929","192.168.43.3","69.171.250.60","TCP","1446","49544  >  443 [ACK] Seq=14016 Ack=547 Win=66268 Len=1392 [TCP segment of a reassembled PDU]"
"278","171.849937","192.168.43.3","69.171.250.60","TCP","1446","49544  >  443 [ACK] Seq=15408 Ack=547 Win=66268 Len=1392 [TCP segment of a reassembled PDU]"
"279","171.850155","69.171.250.60","192.168.43.3","TCP","54","443  >  49544 [ACK] Seq=547 Ack=8448 Win=46080 Len=0"
"280","171.850186","192.168.43.3","69.171.250.60","TLSv1.3","264","Application Data"
"281","171.869822","172.217.194.94","192.168.43.3","UDP","1081","443  >  53942 Len=1039"
"282","171.869938","172.217.194.94","192.168.43.3","UDP","67","443  >  53942 Len=25"
"283","171.870835","192.168.43.3","172.217.194.94","UDP","75","53942  >  443 Len=33"
"284","171.907114","172.217.194.101","192.168.43.3","UDP","67","443  >  53943 Len=25"
"285","171.927159","69.171.250.60","192.168.43.3","TLSv1.3","269","Application Data"
"286","171.970125","172.217.194.101","192.168.43.3","UDP","873","443  >  53943 Len=831"
"287","171.997501","192.168.43.3","172.217.194.101","UDP","75","53943  >  443 Len=33"
"288","172.013480","172.217.194.101","192.168.43.3","UDP","319","443  >  53943 Len=277"
"289","172.025287","69.171.250.60","192.168.43.3","TCP","54","443  >  49544 [ACK] Seq=762 Ack=15408 Win=60160 Len=0"
"290","172.025440","69.171.250.60","192.168.43.3","TCP","54","443  >  49544 [ACK] Seq=762 Ack=16800 Win=62976 Len=0"
"291","172.042466","192.168.43.3","172.217.194.101","UDP","75","53943  >  443 Len=33"
"292","172.122535","192.168.43.3","69.171.250.60","TCP","54","49544  >  443 [ACK] Seq=17010 Ack=762 Win=66052 Len=0"
"293","172.182774","69.171.250.60","192.168.43.3","TCP","335","[TCP Retransmission] 443  >  49544 [PSH, ACK] Seq=547 Ack=17010 Win=65536 Len=281"
"294","172.182860","192.168.43.3","69.171.250.60","TCP","66","[TCP ACKed unseen segment] 49544  >  443 [ACK] Seq=17010 Ack=828 Win=65988 Len=0 SLE=547 SRE=762"
"295","172.853543","69.171.250.60","192.168.43.3","TLSv1.3","359","[TCP Previous segment not captured] , Application Data"
"296","172.853640","192.168.43.3","69.171.250.60","TCP","66","[TCP Dup ACK 294#1] 49544  >  443 [ACK] Seq=17010 Ack=828 Win=65988 Len=0 SLE=1811 SRE=2116"
"297","172.853958","69.171.250.60","192.168.43.3","TLSv1.3","108","[TCP Previous segment not captured] , Application Data"
"298","172.853960","69.171.250.60","192.168.43.3","TLSv1.3","117","Application Data"
"299","172.854029","192.168.43.3","69.171.250.60","TCP","74","[TCP Dup ACK 294#2] 49544  >  443 [ACK] Seq=17010 Ack=828 Win=65988 Len=0 SLE=2264 SRE=2318 SLE=1811 SRE=2116"
"300","172.854154","192.168.43.3","69.171.250.60","TCP","74","[TCP Dup ACK 294#3] 49544  >  443 [ACK] Seq=17010 Ack=828 Win=65988 Len=0 SLE=2264 SRE=2381 SLE=1811 SRE=2116"
"301","172.907662","69.171.250.60","192.168.43.3","TCP","1037","[TCP Out-Of-Order] 443  >  49544 [PSH, ACK] Seq=828 Ack=17010 Win=65536 Len=983"
"302","172.907664","69.171.250.60","192.168.43.3","TCP","202","[TCP Out-Of-Order] 443  >  49544 [PSH, ACK] Seq=2116 Ack=17010 Win=65536 Len=148"
"303","172.907712","192.168.43.3","69.171.250.60","TCP","66","49544  >  443 [ACK] Seq=17010 Ack=2116 Win=66816 Len=0 SLE=2264 SRE=2381"
"304","172.907781","192.168.43.3","69.171.250.60","TCP","54","49544  >  443 [ACK] Seq=17010 Ack=2381 Win=66548 Len=0"
"305","172.921085","69.171.250.60","192.168.43.3","TLSv1.3","950","Application Data"
"306","173.085500","69.171.250.60","192.168.43.3","TLSv1.3","1037","[TCP Spurious Retransmission] , Application Data"
"307","173.085553","192.168.43.3","69.171.250.60","TCP","66","49544  >  443 [ACK] Seq=17010 Ack=3277 Win=65652 Len=0 SLE=828 SRE=1811"
"308","173.085773","69.171.250.60","192.168.43.3","TLSv1.3","202","[TCP Spurious Retransmission] , Application Data"
"309","173.085794","192.168.43.3","69.171.250.60","TCP","66","[TCP Dup ACK 307#1] 49544  >  443 [ACK] Seq=17010 Ack=3277 Win=65652 Len=0 SLE=2116 SRE=2264"
"310","173.271533","192.168.43.3","69.171.250.60","TLSv1.3","180","Application Data"
"311","173.272754","192.168.43.3","69.171.250.60","TLSv1.3","158","Application Data"
"312","173.457645","192.168.43.3","74.125.68.188","TCP","55","[TCP Keep-Alive] 49534  >  5228 [ACK] Seq=1 Ack=1 Win=16274 Len=1"
"313","173.543971","74.125.68.188","192.168.43.3","TCP","66","[TCP Keep-Alive ACK] 5228  >  49534 [ACK] Seq=1 Ack=2 Win=265 Len=0 SLE=1 SRE=2"
"314","173.575593","69.171.250.60","192.168.43.3","TLSv1.3","88","Application Data"
"315","173.777404","192.168.43.3","69.171.250.60","TCP","54","49544  >  443 [ACK] Seq=17240 Ack=3311 Win=65620 Len=0"
"316","174.726458","192.168.43.3","69.171.250.60","TLSv1.3","174","Application Data"
"317","174.807935","69.171.250.60","192.168.43.3","TCP","54","443  >  49544 [ACK] Seq=3311 Ack=17360 Win=65536 Len=0"
"318","175.037102","69.171.250.60","192.168.43.3","TLSv1.3","88","Application Data"
"319","175.232107","192.168.43.3","69.171.250.60","TCP","54","49544  >  443 [ACK] Seq=17360 Ack=3345 Win=65584 Len=0"
"320","175.505686","1a:02:ae:9a:0d:ef","HonHaiPr_48:58:9d","ARP","42","Who has 192.168.43.3? Tell 192.168.43.92"
"321","175.505719","HonHaiPr_48:58:9d","1a:02:ae:9a:0d:ef","ARP","42","192.168.43.3 is at c4:8e:8f:48:58:9d"
"322","176.255154","69.171.250.60","192.168.43.3","TLSv1.3","441","Application Data"
"323","176.452014","192.168.43.3","69.171.250.60","TCP","54","49544  >  443 [ACK] Seq=17360 Ack=3732 Win=66816 Len=0"
"324","176.943120","192.168.43.3","69.171.250.60","TLSv1.3","152","Application Data"
"325","176.945352","192.168.43.3","69.171.250.60","TLSv1.3","150","Application Data"
"326","176.990407","69.171.250.60","192.168.43.3","TLSv1.3","333","[TCP Previous segment not captured] , Continuation Data"
"327","176.990513","192.168.43.3","69.171.250.60","TCP","66","[TCP Dup ACK 323#1] 49544  >  443 [ACK] Seq=17554 Ack=3732 Win=66816 Len=0 SLE=6024 SRE=6303"
"328","177.039628","69.171.250.60","192.168.43.3","TCP","54","443  >  49544 [ACK] Seq=6303 Ack=17458 Win=65536 Len=0"
"329","177.046764","69.171.250.60","192.168.43.3","TCP","54","443  >  49544 [ACK] Seq=6303 Ack=17554 Win=65536 Len=0"
"330","177.106642","192.168.43.3","69.171.250.60","TLSv1.3","114","Application Data"
"331","177.209620","69.171.250.60","192.168.43.3","TCP","1446","443  >  49544 [ACK] Seq=6303 Ack=17614 Win=65536 Len=1392 [TCP segment of a reassembled PDU]"
"332","177.209683","192.168.43.3","69.171.250.60","TCP","66","[TCP Dup ACK 323#2] 49544  >  443 [ACK] Seq=17614 Ack=3732 Win=66816 Len=0 SLE=6024 SRE=7695"
"333","177.254886","69.171.250.60","192.168.43.3","TLSv1.3","1446","Application Data [TCP segment of a reassembled PDU]"
"334","177.254984","192.168.43.3","69.171.250.60","TCP","66","[TCP Dup ACK 323#3] 49544  >  443 [ACK] Seq=17614 Ack=3732 Win=66816 Len=0 SLE=6024 SRE=9087"
"335","177.288888","192.168.43.3","69.171.250.60","TLSv1.3","158","Application Data"
"336","177.339274","69.171.250.60","192.168.43.3","TLSv1.3","1446","[TCP Previous segment not captured] , Continuation Data"
"337","177.339412","192.168.43.3","69.171.250.60","TCP","74","[TCP Dup ACK 323#4] 49544  >  443 [ACK] Seq=17718 Ack=3732 Win=66816 Len=0 SLE=10479 SRE=11871 SLE=6024 SRE=9087"
"338","177.388106","69.171.250.60","192.168.43.3","TCP","1446","[TCP Out-Of-Order] 443  >  49544 [ACK] Seq=9087 Ack=17614 Win=65536 Len=1392"
"339","177.388178","192.168.43.3","69.171.250.60","TCP","66","[TCP Dup ACK 323#5] 49544  >  443 [ACK] Seq=17718 Ack=3732 Win=66816 Len=0 SLE=6024 SRE=11871"
"340","177.440230","69.171.250.60","192.168.43.3","TLSv1.3","1446","Continuation Data"
"341","177.440296","192.168.43.3","69.171.250.60","TCP","66","[TCP Dup ACK 323#6] 49544  >  443 [ACK] Seq=17718 Ack=3732 Win=66816 Len=0 SLE=6024 SRE=13263"
"342","177.472954","69.171.250.60","192.168.43.3","TCP","954","[TCP Out-Of-Order] 443  >  49544 [PSH, ACK] Seq=3732 Ack=17614 Win=65536 Len=900"
"343","177.473020","192.168.43.3","69.171.250.60","TCP","66","49544  >  443 [ACK] Seq=17718 Ack=4632 Win=65916 Len=0 SLE=6024 SRE=13263"
"344","177.500321","69.171.250.60","192.168.43.3","TCP","54","443  >  49544 [ACK] Seq=13263 Ack=17718 Win=65536 Len=0"
"345","177.558597","69.171.250.60","192.168.43.3","TLSv1.3","1446","Continuation Data"
"346","177.558651","192.168.43.3","69.171.250.60","TCP","66","[TCP Dup ACK 343#1] 49544  >  443 [ACK] Seq=17718 Ack=4632 Win=65916 Len=0 SLE=6024 SRE=14655"
"347","177.601231","69.171.250.60","192.168.43.3","TLSv1.3","1446","Continuation Data"
